### ISSUE TITLE
No output when listening for HTTP requests to Docker Container in Kubernetes

### ISSUE THREAD

**Issue by samuelmanzer** [buger/goreplay#499]
I'm running this `gor` release: `gor_0.16.1_x64.tar.gz`. I have it listen to this address: 

```
sudo ./goreplay --input-raw 10.233.117.5:80 --output-stdout
```
**The problem**: Sending `curl`s to this address from a different machine produces no output from `gor`. Using `tcpdump` works just fine, and prints the packets from the `curl`. 

```
$ sudo tcpdump -n 'dst host 10.233.117.5 and dst port 80'
tcpdump: verbose output suppressed, use -v or -vv for full protocol decode
listening on docker0, link-type EN10MB (Ethernet), capture size 262144 bytes
18:40:00.524536 IP 172.17.8.101.46504 > 10.233.117.5.80: Flags [S], seq 1700034507, win 29200, options [mss 1460,sackOK,TS val 125823297 ecr 0,nop,wscale 7], length 0
18:40:00.525574 IP 172.17.8.101.46504 > 10.233.117.5.80: Flags [.], ack 3389175068, win 229, options [nop,nop,TS val 125823297 ecr 213918039], length 0
18:40:00.525701 IP 172.17.8.101.46504 > 10.233.117.5.80: Flags [P.], seq 0:76, ack 1, win 229, options [nop,nop,TS val 125823297 ecr 213918039], length 76: HTTP: GET / HTTP/1.1
18:40:00.526697 IP 172.17.8.101.46504 > 10.233.117.5.80: Flags [.], ack 239, win 237, options [nop,nop,TS val 125823297 ecr 213918040], length 0
18:40:00.526732 IP 172.17.8.101.46504 > 10.233.117.5.80: Flags [.], ack 851, win 247, options [nop,nop,TS val 125823297 ecr 213918040], length 0
18:40:00.527278 IP 172.17.8.101.46504 > 10.233.117.5.80: Flags [F.], seq 76, ack 851, win 247, options [nop,nop,TS val 125823297 ecr 213918040], length 0
18:40:00.528207 IP 172.17.8.101.46504 > 10.233.117.5.80: Flags [.], ack 852, win 247, options [nop,nop,TS val 125823298 ecr 213918040], length 0
```

This address maps to the docker0 interface:

```
$ route
Destination     Gateway         Genmask         Flags Metric Ref    Use Iface
10.233.117.0    *               255.255.255.0   U     0      0        0 docker0
```

Appreciate any advice! Thank you for taking a look.

**Comment by buger** [comment]
Hello! Apologies for late reply.

There is some specifics in capturing traffic from virtual interfaces. Upcoming GoReplay release address this issue by introducing new --input-raw-bpf-filter option where you can override default network filtering rules. Issue itself comes from the fact that traffic coming to virtual interface do not match with interface IP. 

Command in your case will look like: `./goreplay --input-raw :80 --input-raw-bpf-filter "dst host 10.233.117.5 and dst port 80"  --output-stdout`. Note that you still need to specify port for the --input-raw. Final release is planned in the next few weeks, but functionality already in master. Attaching binaries here:

[gor_0.17.PRE_1_mac.tar.gz](https://github.com/buger/goreplay/files/1253831/gor_0.17.PRE_1_mac.tar.gz)
[gor_0.17.PRE_1_x64.tar.gz](https://github.com/buger/goreplay/files/1253832/gor_0.17.PRE_1_x64.tar.gz)

**Comment by samuelmanzer** [comment]
Thank you for thorough reply! Sounds like everything is good then, closing issue :)
