### ISSUE TITLE
some response not found with output-file log

### ISSUE THREAD

**Issue by pylin-1164** [buger/goreplay#694]
the log not write response head and content when i use " -input-raw-track-response" with **Version1.0.0**
but when i use the [https://github.com/buger/gor/files/341284/gor_fix_body_size_x64.tar.gz](https://github.com/buger/gor/files/341284/gor_fix_body_size_x64.tar.gz) is perfect
### goreplay_0.log is 
`
1 36b661d4aa76ce9679f59b75fb7298a1c9fab542 1566659763479218765
GET /nexus/service/local/outreach/welcome/?version=2.14.4-03&versionMm=2.14&edition=OSS&usertype=anonymous HTTP/1.1
Host: 172.16.139.10:82
Connection: keep-alive
Upgrade-Insecure-Requests: 1
User-Agent: Mozilla/5.0 (Windows NT 6.1; Win64; x64) AppleWebKit/537.36 (KHTML, like Gecko) Chrome/71.0.3578.98 Safari/537.36
Accept: text/html,application/xhtml+xml,application/xml;q=0.9,image/webp,image/apng,*/*;q=0.8
Referer: http://172.16.139.10:82/nexus/
Accept-Encoding: gzip, deflate
Accept-Language: zh-CN,zh;q=0.9,en;q=0.8
Cookie: _ga=GA1.1.931462417.1566530464; _gid=GA1.1.255916120.1566971798

---

1 a785e29aadc6f17f72132299bc09bcff917cdfaa 1566659786232285339
GET /nexus/service/local/outreach/welcome/jquery-3.3.1.min.js HTTP/1.1
Host: 172.16.139.10:82
Connection: keep-alive
User-Agent: Mozilla/5.0 (Windows NT 6.1; Win64; x64) AppleWebKit/537.36 (KHTML, like Gecko) Chrome/71.0.3578.98 Safari/537.36
Accept: */*
Referer: http://172.16.139.10:82/nexus/service/local/outreach/welcome/?version=2.14.4-03&versionMm=2.14&edition=OSS&usertype=anonymous
Accept-Encoding: gzip, deflate
Accept-Language: zh-CN,zh;q=0.9,en;q=0.8
Cookie: _ga=GA1.1.931462417.1566530464; _gid=GA1.1.255916120.1566971798

`

**Comment by WenchaozT** [comment]
@buger I had the same issue：input response is missed，but the output response well
```
./gor1 --input-raw :8414 --output-http="***:8414" --output-file requests.log --input-raw-track-response --output-http-tck-response
Version: 1.0.0
```

```
1 23f1dd42ac3d816a6a8d19ff15d0217454b3eee3 1571129448571178143
GET /api/v1/product/consts/all HTTP/1.1
User-Agent: PostmanRuntime/7.17.1
Accept: */*
Cache-Control: no-cache
Postman-Token: 1d735d15-8670-418d-ac70-981edca6e75e
Host: 10.25.119.39:8414
Accept-Encoding: gzip, deflate
Connection: keep-alive


🐵🙈🙉
3 23f1dd42ac3d816a6a8d19ff15d0217454b3eee3 1571129450991948026 313314630
HTTP/1.1 200 OK
Date: Tue, 15 Oct 2019 08:50:51 GMT
X-Application-Context: application:8414
Content-Type: application/json;charset=utf-8
Transfer-Encoding: chunked
```

and tcmdump result is：
```
tcpdump port 8414 -A
tcpdump: verbose output suppressed, use -v or -vv for full protocol decode
listening on eth0, link-type EN10MB (Ethernet), capture size 65535 bytes

16:56:47.875230 IP 172.25.131.155.49611 > api-test01.mt.8414: Flags [S], seq 2711996019, win 65535, options [mss 1460,nop,wscale 6,nop,nop,TS val 1264865401 ecr 0,sackOK,eol], length 0
E..@..@.5.......
.w'.. ....s.........f.............
KdPy........
16:56:47.875270 IP api-test01.mt.8414 > 172.25.131.155.49611: Flags [S.], seq 1536849336, ack 2711996020, win 28960, options [mss 1460,sackOK,TS val 180307873 ecr 1264865401,nop,wscale 9], length 0
E..<..@.@...
.w'.... ...[.u....t..q .#.........

.G.KdPy...
16:56:47.930276 IP 172.25.131.155.49611 > api-test01.mt.8414: Flags [.], ack 1, win 2058, options [nop,nop,TS val 1264865457 ecr 180307873], length 0
E..4..@.5.......
.w'.. ....t[.u....
.0.....
KdP.
.G.
16:56:47.931580 IP 172.25.131.155.49611 > api-test01.mt.8414: Flags [P.], seq 1:373, ack 1, win 2058, options [nop,nop,TS val 1264865458 ecr 180307873], length 372
E.....@.5..[....
.w'.. ....t[.u....
Jv.....
KdP.
.G.GET /api/v1/product/consts/all HTTP/1.1
User-Agent: PostmanRuntime/7.17.1
Accept: */*
Cache-Control: no-cache
Postman-Token: dd37756b-c28a-4105-bd14-fbced319cc47
Host: 10.25.119.39:8414
Accept-Encoding: gzip, deflate
Connection: keep-alive


16:56:47.931598 IP api-test01.mt.8414 > 172.25.131.155.49611: Flags [.], ack 373, win 59, options [nop,nop,TS val 180307930 ecr 1264865458], length 0
E..42a@.@.Wn
.w'.... ...[.u........;.......

.G.KdP.
16:56:47.948712 IP api-test01.mt.8414 > 172.25.131.155.49611: Flags [.], seq 1:2897, ack 373, win 59, options [nop,nop,TS val 180307947 ecr 1264865458], length 2896
E...2b@.@.L.
.w'.... ...[.u........;.k.....

.G.KdP.HTTP/1.1 200 OK
Date: Tue, 15 Oct 2019 08:56:47 GMT
X-Application-Context: application:8414
Content-Type: application/json;charset=utf-8
Transfer-Encoding: chunked
```
